{
    "last_name": "Цой",
    "first_name": "Иван",
    "patr_name": "Леонидович",
    "sex": 2,
    "birth_date": "28-11-1989",
    "SNILS": "036789",
    "INN": "036789",
    "organization": "134",
    "org_structure": "134",
    "speciality": "233232",
    "post": "036789",
    "login": "036789",
    "regional_code": "036789"
}